id,text,category
1,"Machine learning is a subset of artificial intelligence.",technology
2,"Deep learning uses neural networks with many layers.",technology
3,"Natural language processing helps computers understand human language.",technology
4,"Python is a popular programming language for data science.",technology
5,"TensorFlow and PyTorch are popular deep learning frameworks.",technology
6,"Data scientists analyze large datasets to find patterns.",technology
7,"Cloud computing provides scalable computing resources on demand.",technology
8,"Cybersecurity protects systems from digital attacks.",technology
9,"Blockchain technology enables decentralized transactions.",technology
10,"The Internet of Things connects everyday devices to the internet.",technology
11,"Quantum computing uses quantum mechanics for computation.",technology
12,"Virtual reality creates immersive digital environments.",technology
13,"Augmented reality overlays digital content on the real world.",technology
14,"5G networks provide faster wireless communication.",technology
15,"Edge computing processes data closer to the source.",technology
16,"The Eiffel Tower is located in Paris, France.",travel
17,"Tokyo is the capital city of Japan.",travel
18,"The Great Wall of China is visible from space.",travel
19,"New York City is known as the Big Apple.",travel
20,"The Colosseum in Rome is an ancient amphitheater.",travel
21,"Sydney Opera House is an iconic Australian landmark.",travel
22,"Machu Picchu is an ancient Incan city in Peru.",travel
23,"The Taj Mahal is a white marble mausoleum in India.",travel
24,"Dubai has the tallest building in the world.",travel
25,"Venice is famous for its canals and gondolas.",travel
26,"A healthy diet includes fruits and vegetables.",health
27,"Regular exercise improves physical and mental health.",health
28,"Sleep is essential for body recovery and brain function.",health
29,"Drinking water keeps the body hydrated.",health
30,"Stress management is important for overall wellbeing.",health
31,"Vitamins and minerals support various body functions.",health
32,"Meditation helps reduce anxiety and improve focus.",health
33,"Walking 10000 steps daily promotes cardiovascular health.",health
34,"Eating breakfast boosts metabolism and energy levels.",health
35,"Good posture prevents back and neck pain.",health
36,"The stock market allows buying and selling of company shares.",finance
37,"Compound interest helps grow savings over time.",finance
38,"Diversification reduces investment risk.",finance
39,"Budgeting helps track income and expenses.",finance
40,"Inflation decreases the purchasing power of money.",finance
41,"Cryptocurrency is a digital form of currency.",finance
42,"Retirement planning ensures financial security in old age.",finance
43,"Credit scores affect loan approval and interest rates.",finance
44,"Mutual funds pool money from many investors.",finance
45,"Emergency funds provide financial safety during crises.",finance
46,"Climate change affects global weather patterns.",environment
47,"Renewable energy sources include solar and wind power.",environment
48,"Recycling reduces waste in landfills.",environment
49,"Deforestation contributes to habitat loss.",environment
50,"Electric vehicles reduce carbon emissions.",environment
51,"Ocean pollution harms marine life.",environment
52,"Sustainable farming practices protect the soil.",environment
53,"Biodiversity is essential for healthy ecosystems.",environment
54,"Carbon footprint measures greenhouse gas emissions.",environment
55,"Water conservation saves a precious natural resource.",environment
56,"Shakespeare wrote many famous plays and sonnets.",literature
57,"The Great Gatsby is a classic American novel.",literature
58,"Poetry uses rhythm and metaphor to express emotions.",literature
59,"Harry Potter series became a global phenomenon.",literature
60,"Jane Austen wrote Pride and Prejudice.",literature
61,"Cooking is both an art and a science.",food
62,"Italian cuisine features pasta and pizza.",food
63,"Sushi is a traditional Japanese dish.",food
64,"Chocolate is made from cacao beans.",food
65,"Spices add flavor and aroma to dishes.",food
66,"Baking requires precise measurements.",food
67,"Coffee is one of the most popular beverages worldwide.",food
68,"Fermentation is used to make bread and beer.",food
69,"Football is the most popular sport globally.",sports
70,"Basketball was invented by James Naismith.",sports
71,"Swimming is a full-body workout.",sports
72,"Tennis is played on various court surfaces.",sports
73,"Marathon running requires endurance training.",sports
74,"Golf originated in Scotland.",sports
75,"Chess is a strategic board game.",sports
76,"Albert Einstein developed the theory of relativity.",science
77,"DNA contains genetic information.",science
78,"The periodic table organizes chemical elements.",science
79,"Gravity keeps planets in orbit around the sun.",science
80,"Photosynthesis converts sunlight into energy.",science
81,"Atoms are the building blocks of matter.",science
82,"The speed of light is approximately 300000 km per second.",science
83,"Evolution explains the diversity of life on Earth.",science
84,"Black holes have extremely strong gravitational pull.",science
85,"Vaccines help prevent infectious diseases.",science
86,"Music can improve mood and reduce stress.",arts
87,"Painting is a form of visual expression.",arts
88,"Dance combines movement with rhythm.",arts
89,"Photography captures moments in time.",arts
90,"Sculpture creates three-dimensional art.",arts
91,"Dogs are loyal companions and pets.",animals
92,"Cats are independent and curious creatures.",animals
93,"Elephants are the largest land animals.",animals
94,"Dolphins are intelligent marine mammals.",animals
95,"Birds migrate to find food and breeding grounds.",animals
96,"Bees play a crucial role in pollination.",animals
97,"Lions are known as the king of the jungle.",animals
98,"Pandas primarily eat bamboo.",animals
99,"Whales are the largest animals on Earth.",animals
100,"Butterflies undergo metamorphosis.",animals
